[
  {
    "id": "christuskirche",
    "coord": [-22.56778, 17.08722],
    "kind": "sight",
    "name": { "en": "Christ Church (Christuskirche)", "de": "Christuskirche" },
    "tags": {
      "interests": ["history", "architecture"],
      "indoor": true,
      "wheelchair": "unknown",
      "dogs": "unknown"
    },
    "hours": { "note": { "de": "Angaben widersprüchlich: Mo–Sa 09:00–17:00 laut audiala.com, Besucher-Reviews (2023) melden dagegen sehr eingeschränkte Öffnung. TODO vor Ort: Zeiten von der Tür fotografieren." } },
    "visit": { "minutes": 20 },
    "body": { "de": { "snapshot": "Evangelisch-lutherische Kirche von Architekt Gottlieb Redecker, Grundsteinlegung 1907, geweiht am 16. Oktober 1910; neoromanischer Bau mit Jugendstil-Einflüssen aus lokalem Quarzsandstein. Wahrzeichen der Stadt, direkt an Parlamentsgärten und Tintenpalast." } },
    "funFact": { "de": "Der Turm aus lokalem Quarzsandstein ist 24 Meter hoch." },
    "sources": [
      "https://en.wikipedia.org/wiki/Christ_Church,_Windhoek",
      "https://www.arebbusch.com/travel-guide-listings/namibian-attractions/christuskirche/",
      "https://audiala.com/en/namibia/windhoek/christ-church-windhoek",
      "https://www.tripadvisor.co.nz/ShowUserReviews-g293821-d600484-r994726828-Christuskirche-Windhoek_Khomas_Region.html"
    ],
    "verification": { "status": "draft" }
  },
  {
    "id": "alte-feste",
    "coord": [-22.56933, 17.08837],
    "kind": "sight",
    "name": { "en": "Alte Feste (Old Fortress)", "de": "Alte Feste" },
    "tags": {
      "interests": ["history", "architecture", "memory-culture"],
      "values": ["memory-culture"],
      "wheelchair": "unknown"
    },
    "hours": { "note": { "de": "Gebäude seit ca. 2015 geschlossen und renovierungsbedürftig; Deutschland unterstützt die Renovierung 2025/26 mit 4,2 Mio. NAD (Auswärtiges Amt). Nur von außen zu besichtigen. TODO vor Ort: aktuellen Baustand prüfen." } },
    "visit": { "minutes": 10 },
    "body": { "de": { "snapshot": "Älteste erhaltene Festung Windhoeks an der Robert Mugabe Avenue, ehemals Museum, seit der Eröffnung des Independence Memorial Museum geschlossen. Nach der Renovierung sind u. a. ein Nationalmuseum für Genozid- und Kolonialgeschichte sowie Kunsthandwerk-Werkstätten geplant. Im Innenhof lagert seit 2013 das abgebaute deutsche Reiterdenkmal." } },
    "sources": [
      "https://en.wikipedia.org/wiki/Alte_Feste",
      "https://windhuk.diplo.de/na-en/2746274-2746274",
      "https://windhuk.diplo.de/na-en/2701370-2701370",
      "https://www.windhoekcc.org.na/alte-feste/",
      "https://en.wikipedia.org/wiki/Reiterdenkmal,_Windhoek"
    ],
    "verification": { "status": "draft" }
  },
  {
    "id": "independence-memorial-museum",
    "coord": [-22.5688, 17.0881],
    "kind": "memorial",
    "name": { "en": "Independence Memorial Museum", "de": "Independence Memorial Museum" },
    "tags": {
      "interests": ["history", "memory-culture"],
      "values": ["memory-culture"],
      "indoor": true,
      "wheelchair": "unknown"
    },
    "cost": { "amount": 0, "note": { "de": "Eintritt frei, Spende erwartet (laut dark-tourism.com, abgerufen Aug 2026). TODO vor Ort: von der Tafel bestätigen." } },
    "hours": { "osm": "Mo-Fr 09:00-17:00; Sa 10:00-17:00", "note": { "de": "So geschlossen; Stand laut dark-tourism.com/kupi.com, abgerufen Aug 2026. TODO vor Ort prüfen." } },
    "visit": { "minutes": 60 },
    "body": { "de": { "snapshot": "2014 eröffnetes, von der nordkoreanischen Firma Mansudae gebautes Museum zum antikolonialen Befreiungskampf; drei Etagen behandeln u. a. den deutschen Genozid an Ovaherero und Nama (1904–1908) — dieselbe Kolonialgeschichte, an die in Bremen der Antikolonialdenkmal-Elefant erinnert. Vor dem Museum steht die Sam-Nujoma-Statue am Platz des früheren deutschen Reiterdenkmals; das Reiterdenkmal selbst lagert heute im Hof der Alten Feste." } },
    "funFact": { "de": "Eröffnet am 20. März 2014, dem Vorabend des 24. Unabhängigkeitstags, durch Präsident Pohamba." },
    "related": [{ "city": "bremen", "poi": "elephant", "relation": "same-story" }],
    "sources": [
      "https://en.wikipedia.org/wiki/Independence_Memorial_Museum_(Namibia)",
      "https://www.dark-tourism.com/index.php/1477-independence-museum-namibia",
      "https://www.kupi.com/en/explore/namibia/windhoek/independence-museum",
      "https://en.wikipedia.org/wiki/Reiterdenkmal,_Windhoek",
      "https://www.windhoekcc.org.na/independence-memorial-museum/"
    ],
    "verification": { "status": "draft" }
  },
  {
    "id": "genocide-memorial",
    "coord": [-22.5688, 17.0881],
    "kind": "memorial",
    "name": { "en": "Genocide Memorial", "de": "Genozid-Denkmal" },
    "tags": {
      "interests": ["history", "memory-culture"],
      "values": ["memory-culture"],
      "wheelchair": "unknown"
    },
    "visit": { "minutes": 10 },
    "body": { "de": { "snapshot": "Denkmal für die Opfer des Genozids an Ovaherero und Nama (1904–1908) durch die deutsche 'Schutztruppe', errichtet von Mansudae und 2014 zusammen mit dem Independence Memorial Museum enthüllt, das es flankiert; es steht vor der Alten Feste nahe der Christuskirche. TODO vor Ort: exakte Koordinate am Denkmal setzen (hier Museums-Koordinate als Näherung)." } },
    "sources": [
      "https://en.wikipedia.org/wiki/Independence_Memorial_Museum_(Namibia)",
      "https://publicdelivery.org/mansudae-overseas-project/",
      "https://www.tripadvisor.com/Attraction_Review-g293821-d19274833-Reviews-Genocide_Memorial-Windhoek_Khomas_Region.html"
    ],
    "verification": { "status": "draft" }
  },
  {
    "id": "tintenpalast",
    "coord": [-22.56667, 17.08917],
    "kind": "sight",
    "name": { "en": "Tintenpalast (Parliament)", "de": "Tintenpalast (Parlament)" },
    "tags": {
      "interests": ["history", "architecture"],
      "wheelchair": "unknown"
    },
    "hours": { "note": { "de": "Sitz des namibischen Parlaments; Innenbesichtigung ungeklärt. TODO vor Ort: ob Führungen möglich sind." } },
    "visit": { "minutes": 15 },
    "body": { "de": { "snapshot": "1912–13 nach Entwurf von Gottlieb Redecker durch die Firma Sander & Kock aus regionalen Materialien als deutsches Verwaltungsgebäude errichtet, eingeweiht am 12. April 1913; heute Sitz des Parlaments Namibias. Davor liegen die Parlamentsgärten." } },
    "sources": [
      "https://en.wikipedia.org/wiki/Parliament_Building,_Windhoek",
      "https://structurae.net/en/structures/tintenpalast"
    ],
    "verification": { "status": "draft" }
  },
  {
    "id": "parliament-gardens",
    "coord": [-22.56694, 17.08806],
    "kind": "park",
    "name": { "en": "Parliament Gardens", "de": "Parlamentsgärten" },
    "tags": {
      "interests": ["nature", "history"],
      "shade": true,
      "wheelchair": "unknown",
      "dogs": "unknown"
    },
    "cost": { "amount": 0 },
    "visit": { "minutes": 30 },
    "body": { "de": { "snapshot": "Kleiner Park zwischen Tintenpalast und Christuskirche, 1932 nach Plänen des Landschaftsarchitekten Hugo Stössel angelegt (ursprünglich 'Tintenpalast-Gärten'), mit altem Olivenhain aus der früheren Plantage. TODO vor Ort: Schatten/Bänke/Abendstimmung prüfen." } },
    "funFact": { "de": "Hier steht Namibias erstes nach der Unabhängigkeit errichtetes Denkmal: die Bronzestatue des Herero-Chiefs Hosea Kutako." },
    "sources": [
      "https://en.wikipedia.org/wiki/Parliament_Gardens",
      "https://en.wikipedia.org/wiki/Parliament_Building,_Windhoek"
    ],
    "verification": { "status": "draft" }
  },
  {
    "id": "turnhalle",
    "coord": [-22.56056, 17.08639],
    "kind": "sight",
    "name": { "en": "Turnhalle", "de": "Turnhalle" },
    "tags": {
      "interests": ["history", "architecture"],
      "wheelchair": "unknown"
    },
    "visit": { "minutes": 10 },
    "body": { "de": { "snapshot": "1909 eingeweihtes Gebäude (Entwurf Otto W. C. Busch) in der Bahnhof Street, ursprünglich Turnhalle eines deutschen Turnvereins; 1975–77 Schauplatz der Turnhallen-Konferenz, die der namibischen Verfassungsgeschichte den Namen gab. Besichtigung von innen ungeklärt — TODO vor Ort." } },
    "sources": [
      "https://en.wikipedia.org/wiki/Turnhalle_(Windhoek)",
      "https://en.wikipedia.org/wiki/Turnhalle_Constitutional_Conference",
      "https://www.windhoekcc.org.na/turnhalle-building-in-bahnhof-street/"
    ],
    "verification": { "status": "draft" }
  },
  {
    "id": "windhoek-railway-station",
    "coord": [-22.5594, 17.081],
    "kind": "sight",
    "name": { "en": "Windhoek Railway Station & TransNamib Museum", "de": "Bahnhof Windhoek & TransNamib-Museum" },
    "tags": {
      "interests": ["history", "architecture", "photo"],
      "indoor": true,
      "wheelchair": "unknown"
    },
    "hours": { "note": { "de": "Öffnungszeiten des Eisenbahnmuseums nicht belegbar — TODO vor Ort. Personenzüge (StarLine) sind seit 2021 ausgesetzt (Stand laut seat61.com, abgerufen Aug 2026)." } },
    "visit": { "minutes": 30 },
    "body": { "de": { "snapshot": "Bahnhof von 1912 im kapholländischen Stil, betrieben von TransNamib; im Gebäude befindet sich das kleine Trans-Namib-Eisenbahnmuseum (gegründet 1. Juli 1993) zur namibischen Verkehrsgeschichte." } },
    "funFact": { "de": "Der Nordflügel wurde 1929 von den South African Railways passend zum Bestandsbau ergänzt." },
    "sources": [
      "https://en.wikipedia.org/wiki/Windhoek_railway_station",
      "https://en.wikipedia.org/wiki/Trans-Namib_Railroad_Museum",
      "https://www.seat61.com/Namibia.htm"
    ],
    "verification": { "status": "draft" }
  },
  {
    "id": "heinitzburg",
    "coord": [-22.57444, 17.0925],
    "kind": "viewpoint",
    "name": { "en": "Heinitzburg Castle", "de": "Heinitzburg" },
    "tags": {
      "interests": ["architecture", "history", "photo"],
      "wheelchair": "unknown"
    },
    "cost": { "note": { "de": "Zugang als Hotel-/Restaurantgast; Konsumkosten. TODO vor Ort: ob Aussicht auch ohne Verzehr zugänglich ist." } },